{"$id":"ev4-stage-anchor@1.3.0","$schema":"https://json-schema.org/draft/2020-12/schema","additionalProperties":false,"allOf":[{"if":{"properties":{"anchor_type":{"const":"NEXT_STAGE_ANCHOR"}},"required":["anchor_type"]},"then":{"properties":{"failure_event_ref":{"type":"null"},"handoff_state":{"properties":{"gate_results":{"properties":{"boundary_transition":{"const":"next_stage"},"next_stage_authorized":{"const":true},"receipt_status":{"const":"valid"}}}}},"repair_target_stage":{"type":"null"},"target_stage":{"minLength":1,"type":"string"}}}},{"if":{"properties":{"anchor_type":{"const":"REPAIR_ANCHOR"}},"required":["anchor_type"]},"then":{"properties":{"failure_event_ref":{"additionalProperties":false,"properties":{"failure_event_id":{"minLength":1,"type":"string"},"failure_event_schema":{"const":"ev4-architect-validation-failure-event@1.0.0"},"failure_event_sha256":{"pattern":"^[a-f0-9]{64}$","type":"string"}},"required":["failure_event_id","failure_event_schema","failure_event_sha256"],"type":"object"},"handoff_state":{"properties":{"gate_results":{"properties":{"boundary_transition":{"const":"repair"},"next_stage_authorized":{"const":false},"receipt_status":{"const":"invalid"}}}}},"repair_target_stage":{"enum":["/decompose","/architectures","/score-evidence","/score-audit"]},"target_stage":{"type":"null"}}}}],"properties":{"anchor_id":{"minLength":1,"type":"string"},"anchor_schema":{"const":"ev4-stage-anchor@1.3.0"},"anchor_type":{"enum":["NEXT_STAGE_ANCHOR","REPAIR_ANCHOR"]},"boundary_ref":{"additionalProperties":false,"properties":{"boundary_id":{"minLength":1,"type":"string"},"boundary_schema":{"const":"ev4-stage-boundary-record@1.1.0"},"boundary_sha256":{"pattern":"^[a-f0-9]{64}$","type":"string"}},"required":["boundary_id","boundary_schema","boundary_sha256"],"type":"object"},"failure_event_ref":{"oneOf":[{"type":"null"},{"additionalProperties":false,"properties":{"failure_event_id":{"minLength":1,"type":"string"},"failure_event_schema":{"const":"ev4-architect-validation-failure-event@1.0.0"},"failure_event_sha256":{"pattern":"^[a-f0-9]{64}$","type":"string"}},"required":["failure_event_id","failure_event_schema","failure_event_sha256"],"type":"object"}]},"handoff_state":{"additionalProperties":false,"properties":{"audit_flags":{"items":{"type":"string"},"type":"array"},"blocking_items":{"items":{"additionalProperties":false,"properties":{"evidence_refs":{"items":{"type":"string"},"type":"array"},"state":{"enum":["confirmed","likely","unknown","blocked","not_applicable"]},"unknown_id":{"minLength":1,"type":"string"}},"required":["unknown_id","state","evidence_refs"],"type":"object"},"type":"array"},"confidence_delta":{"items":{"additionalProperties":false,"properties":{"current_confidence":{"enum":["confirmed","likely","unknown","blocked","not_applicable"]},"direction":{"enum":["increased","decreased","unchanged","resolved","new_unknown"]},"downstream_impact":{"minLength":1,"type":"string"},"evidence_refs":{"items":{"type":"string"},"type":"array"},"previous_confidence":{"enum":["confirmed","likely","unknown","blocked","not_applicable"]},"reason":{"minLength":1,"type":"string"},"subject_id":{"minLength":1,"type":"string"},"subject_type":{"enum":["unknown","candidate","gate","evidence"]}},"required":["subject_id","subject_type","previous_confidence","current_confidence","direction","reason","evidence_refs","downstream_impact"],"type":"object"},"type":"array"},"critical_unknowns":{"items":{"additionalProperties":false,"properties":{"evidence_refs":{"items":{"type":"string"},"type":"array"},"state":{"enum":["confirmed","likely","unknown","blocked","not_applicable"]},"unknown_id":{"minLength":1,"type":"string"}},"required":["unknown_id","state","evidence_refs"],"type":"object"},"type":"array"},"gate_results":{"additionalProperties":false,"properties":{"boundary_transition":{"enum":["next_stage","repair"]},"next_stage_authorized":{"type":"boolean"},"receipt_status":{"enum":["valid","invalid"]}},"required":["receipt_status","boundary_transition","next_stage_authorized"],"type":"object"},"partial_rerun_state":{"additionalProperties":false,"properties":{"downstream_payloads_dependent_on_this_stage":{"items":{"enum":["/decompose","/architectures","/score-evidence","/score-audit"]},"type":"array"},"earliest_safe_rerun_stage":{"enum":["/decompose","/architectures","/score-evidence","/score-audit"]},"invalidation_triggers":{"items":{"type":"string"},"type":"array"},"reusable_until":{"type":["string","null"]}},"required":["reusable_until","invalidation_triggers","earliest_safe_rerun_stage","downstream_payloads_dependent_on_this_stage"],"type":"object"},"required_user_confirmations":{"items":{"type":"string"},"type":"array"},"stage_boundary":{"additionalProperties":false,"properties":{"allowed_work":{"items":{"type":"string"},"type":"array"},"forbidden_work":{"items":{"type":"string"},"type":"array"},"stop_conditions":{"items":{"type":"string"},"type":"array"}},"required":["allowed_work","forbidden_work","stop_conditions"],"type":"object"}},"required":["critical_unknowns","blocking_items","confidence_delta","gate_results","audit_flags","required_user_confirmations","partial_rerun_state","stage_boundary"],"type":"object"},"repair_target_stage":{"enum":["/decompose","/architectures","/score-evidence","/score-audit",null],"type":["string","null"]},"run_id":{"minLength":1,"type":"string"},"source_stage":{"enum":["/decompose","/architectures","/score-evidence","/score-audit"]},"target_stage":{"type":["string","null"]}},"required":["anchor_schema","anchor_id","run_id","anchor_type","source_stage","target_stage","repair_target_stage","boundary_ref","failure_event_ref","handoff_state"],"type":"object"}
