{
  "anchor_id": "asb-anchor-run-asb-fixture-score-evidence-38a0a1566038",
  "anchor_schema": "ev4-stage-anchor@1.3.0",
  "anchor_type": "NEXT_STAGE_ANCHOR",
  "boundary_ref": {
    "boundary_id": "asb-boundary-run-asb-fixture-score-evidence-b07f5e1845ac",
    "boundary_schema": "ev4-stage-boundary-record@1.1.0",
    "boundary_sha256": "38a0a1566038f1b401c16eb02954b36d900617ab7c1df63eeb6dafe2f681e355"
  },
  "failure_event_ref": null,
  "handoff_state": {
    "audit_flags": [
      "machine_authorization_forbidden"
    ],
    "blocking_items": [],
    "confidence_delta": [
      {
        "current_confidence": "unknown",
        "direction": "decreased",
        "downstream_impact": "must_remain_visible_downstream",
        "evidence_refs": [
          "s2"
        ],
        "previous_confidence": "blocked",
        "reason": "derived_from_validated_stage_artifact",
        "subject_id": "U-1",
        "subject_type": "unknown"
      }
    ],
    "critical_unknowns": [
      {
        "evidence_refs": [
          "s2"
        ],
        "state": "unknown",
        "unknown_id": "U-1"
      }
    ],
    "gate_results": {
      "boundary_transition": "next_stage",
      "next_stage_authorized": true,
      "receipt_status": "valid"
    },
    "partial_rerun_state": {
      "downstream_payloads_dependent_on_this_stage": [
        "/score-audit"
      ],
      "earliest_safe_rerun_stage": "/score-evidence",
      "invalidation_triggers": [
        "artifact_bytes_changed",
        "upstream_lineage_changed",
        "diagnostic_ownership_changed"
      ],
      "reusable_until": null
    },
    "required_user_confirmations": [],
    "stage_boundary": {
      "allowed_work": [
        "/score-audit"
      ],
      "forbidden_work": [
        "independent_authorization",
        "downstream_reconstruction"
      ],
      "stop_conditions": [
        "bundle_integrity_invalid"
      ]
    }
  },
  "repair_target_stage": null,
  "run_id": "run-asb-fixture",
  "source_stage": "/score-evidence",
  "target_stage": "/score-audit"
}
